{
  "format": "worldmusichub-complete-score",
  "version": 1,
  "source": {
    "format": "midi",
    "bytes": 422,
    "sha256": "c3efc912bcbb03b4f7bfd582a314c9aa1caae150be2295840223d3870c79d402"
  },
  "notation": {
    "format_metadata": {
      "schema_revision": 2,
      "producer": "WorldMusicHub",
      "producer_version": "0.2.0-alpha.1"
    },
    "version": 1,
    "id": "midi-3cc7f45634997241",
    "title": "Clean Practice Fixture",
    "composer": "",
    "provenance": {
      "kind": "user_import",
      "attribution": "User-supplied MIDI performance; ownership and usage rights are not verified. Notation is inferred, not original sheet music.",
      "source_url": null,
      "license": null
    },
    "parts": [
      {
        "id": "midi-t2-c1",
        "name": "Keys · channel 1",
        "instrument": "MIDI channel 1",
        "notes": [
          {
            "id": "midi-t2-c1-e5",
            "at": {
              "numerator": 0,
              "denominator": 1
            },
            "duration": {
              "numerator": 1,
              "denominator": 4
            },
            "pitch": {
              "step": "C",
              "alter": 0,
              "octave": 4
            },
            "voice": "inferred-1",
            "staff": 1,
            "velocity": 76,
            "tie_start": false,
            "tie_stop": false
          },
          {
            "id": "midi-t2-c1-e7",
            "at": {
              "numerator": 1,
              "denominator": 2
            },
            "duration": {
              "numerator": 1,
              "denominator": 4
            },
            "pitch": {
              "step": "E",
              "alter": 0,
              "octave": 4
            },
            "voice": "inferred-1",
            "staff": 1,
            "velocity": 80,
            "tie_start": false,
            "tie_stop": false
          },
          {
            "id": "midi-t2-c1-e9",
            "at": {
              "numerator": 1,
              "denominator": 1
            },
            "duration": {
              "numerator": 1,
              "denominator": 4
            },
            "pitch": {
              "step": "G",
              "alter": 0,
              "octave": 4
            },
            "voice": "inferred-1",
            "staff": 1,
            "velocity": 84,
            "tie_start": false,
            "tie_stop": false
          },
          {
            "id": "midi-t2-c1-e11",
            "at": {
              "numerator": 3,
              "denominator": 2
            },
            "duration": {
              "numerator": 1,
              "denominator": 4
            },
            "pitch": {
              "step": "E",
              "alter": 0,
              "octave": 4
            },
            "voice": "inferred-1",
            "staff": 1,
            "velocity": 88,
            "tie_start": false,
            "tie_stop": false
          },
          {
            "id": "midi-t2-c1-e13",
            "at": {
              "numerator": 2,
              "denominator": 1
            },
            "duration": {
              "numerator": 1,
              "denominator": 2
            },
            "pitch": {
              "step": "C",
              "alter": 0,
              "octave": 4
            },
            "voice": "inferred-1",
            "staff": 1,
            "velocity": 76,
            "tie_start": false,
            "tie_stop": false
          },
          {
            "id": "midi-t2-c1-e15",
            "at": {
              "numerator": 3,
              "denominator": 1
            },
            "duration": {
              "numerator": 1,
              "denominator": 2
            },
            "pitch": {
              "step": "G",
              "alter": 0,
              "octave": 4
            },
            "voice": "inferred-1",
            "staff": 1,
            "velocity": 80,
            "tie_start": false,
            "tie_stop": false
          },
          {
            "id": "midi-t2-c1-e17",
            "at": {
              "numerator": 4,
              "denominator": 1
            },
            "duration": {
              "numerator": 1,
              "denominator": 1
            },
            "pitch": {
              "step": "C",
              "alter": 0,
              "octave": 4
            },
            "voice": "inferred-1",
            "staff": 1,
            "velocity": 84,
            "tie_start": false,
            "tie_stop": false
          },
          {
            "id": "midi-t2-c1-e19",
            "at": {
              "numerator": 8,
              "denominator": 1
            },
            "duration": {
              "numerator": 1,
              "denominator": 1
            },
            "pitch": {
              "step": "E",
              "alter": 0,
              "octave": 4
            },
            "voice": "inferred-1",
            "staff": 1,
            "velocity": 88,
            "tie_start": false,
            "tie_stop": false
          },
          {
            "id": "midi-t2-c1-e21",
            "at": {
              "numerator": 12,
              "denominator": 1
            },
            "duration": {
              "numerator": 1,
              "denominator": 1
            },
            "pitch": {
              "step": "G",
              "alter": 0,
              "octave": 4
            },
            "voice": "inferred-1",
            "staff": 1,
            "velocity": 76,
            "tie_start": false,
            "tie_stop": false
          },
          {
            "id": "midi-t2-c1-e23",
            "at": {
              "numerator": 16,
              "denominator": 1
            },
            "duration": {
              "numerator": 1,
              "denominator": 1
            },
            "pitch": {
              "step": "C",
              "alter": 0,
              "octave": 5
            },
            "voice": "inferred-1",
            "staff": 1,
            "velocity": 80,
            "tie_start": false,
            "tie_stop": false
          },
          {
            "id": "midi-t2-c1-e25",
            "at": {
              "numerator": 24,
              "denominator": 1
            },
            "duration": {
              "numerator": 1,
              "denominator": 1
            },
            "pitch": {
              "step": "C",
              "alter": 0,
              "octave": 4
            },
            "voice": "inferred-1",
            "staff": 1,
            "velocity": 84,
            "tie_start": false,
            "tie_stop": false
          },
          {
            "id": "midi-t2-c1-e27",
            "at": {
              "numerator": 32,
              "denominator": 1
            },
            "duration": {
              "numerator": 1,
              "denominator": 1
            },
            "pitch": {
              "step": "E",
              "alter": 0,
              "octave": 4
            },
            "voice": "inferred-1",
            "staff": 1,
            "velocity": 88,
            "tie_start": false,
            "tie_stop": false
          },
          {
            "id": "midi-t2-c1-e29",
            "at": {
              "numerator": 40,
              "denominator": 1
            },
            "duration": {
              "numerator": 1,
              "denominator": 1
            },
            "pitch": {
              "step": "G",
              "alter": 0,
              "octave": 4
            },
            "voice": "inferred-1",
            "staff": 1,
            "velocity": 76,
            "tie_start": false,
            "tie_stop": false
          },
          {
            "id": "midi-t2-c1-e31",
            "at": {
              "numerator": 48,
              "denominator": 1
            },
            "duration": {
              "numerator": 1,
              "denominator": 1
            },
            "pitch": {
              "step": "C",
              "alter": 0,
              "octave": 5
            },
            "voice": "inferred-1",
            "staff": 1,
            "velocity": 80,
            "tie_start": false,
            "tie_stop": false
          },
          {
            "id": "midi-t2-c1-e33",
            "at": {
              "numerator": 56,
              "denominator": 1
            },
            "duration": {
              "numerator": 1,
              "denominator": 1
            },
            "pitch": {
              "step": "C",
              "alter": 0,
              "octave": 4
            },
            "voice": "inferred-1",
            "staff": 1,
            "velocity": 84,
            "tie_start": false,
            "tie_stop": false
          },
          {
            "id": "midi-t2-c1-e35",
            "at": {
              "numerator": 60,
              "denominator": 1
            },
            "duration": {
              "numerator": 1,
              "denominator": 1
            },
            "pitch": {
              "step": "E",
              "alter": 0,
              "octave": 4
            },
            "voice": "inferred-1",
            "staff": 1,
            "velocity": 88,
            "tie_start": false,
            "tie_stop": false
          },
          {
            "id": "midi-t2-c1-e37",
            "at": {
              "numerator": 62,
              "denominator": 1
            },
            "duration": {
              "numerator": 2,
              "denominator": 1
            },
            "pitch": {
              "step": "G",
              "alter": 0,
              "octave": 4
            },
            "voice": "inferred-1",
            "staff": 1,
            "velocity": 76,
            "tie_start": false,
            "tie_stop": false
          }
        ]
      },
      {
        "id": "midi-t3-c2",
        "name": "Plucks · channel 2",
        "instrument": "MIDI channel 2",
        "notes": [
          {
            "id": "midi-t3-c2-e5",